title,news_url,image_url,text,sentiment,type,source_name,date,topics
"The Best Stocks To Buy Are The 'Best Places To Work'",https://seekingalpha.com/article/4268106-best-stocks-buy-best-places-work?source=feed,https://cdn.snapi.dev/images/v1/t/e/tech723.jpg,"Management, and more precisely culture, is widely recognized as an important factor in determining the long-term success of a company.",Positive,Article,"Seeking Alpha","Tue, 04 Jun 2019 01:53:45 -0400",
"Dow futures slightly higher as trade, growth concerns persist",https://www.cnbc.com/2019/06/04/stock-market-wall-street-monitors-trade-and-growth-concerns.html,https://cdn.snapi.dev/images/v1/5/s/5stck.jpg,"Market focus has shifted to monetary policy this week, with a flurry of central banks across the world set to announce whether to adjust interest rate settings.",Positive,Article,CNBC,"Tue, 04 Jun 2019 01:46:00 -0400",
"Australia's central bank cuts rates to 1.25%",https://www.cnbc.com/2019/06/04/australias-central-bank-cuts-rates-to-1point25percent.html,https://cdn.snapi.dev/images/v1/4/r/4resv.jpg,"It was the first easing in policy since mid-2016.",Negative,Article,CNBC,"Tue, 04 Jun 2019 00:38:00 -0400",
"World's biggest firms foresee $1 trillion climate cost hit, report finds",https://www.cnbc.com/2019/06/04/worlds-biggest-firms-foresee-1-trillion-climate-cost-hit-report.html,https://cdn.snapi.dev/images/v1/3/c/3clim-2.jpg,"More than 200 of the world's largest listed companies forecast that climate change could cost them a combined total of almost $1 trillion, according to a report.",Negative,Article,CNBC,"Tue, 04 Jun 2019 00:27:00 -0400",
"China is ramping up its own chip industry amid a brewing tech war. That could hurt US firms",https://www.cnbc.com/2019/06/04/china-ramps-up-own-semiconductor-industry-amid-the-trade-war.html,https://cdn.snapi.dev/images/v1/2/k/2kir.jpg,"""If the United States blocks the Chinese industry for a long time, it will inspire China to lead another ecosystem,"" one analyst said.",Negative,Article,CNBC,"Tue, 04 Jun 2019 00:17:00 -0400",
