title,news_url,image_url,text,sentiment,type,source_name,date,topics
"Stocks rebound from worst day of the year—here's what 4 experts are watching now",https://www.cnbc.com/2019/08/06/stocks-comeback-from-worst-day-of-2019what-4-experts-are-watching-now.html,https://cdn.snapi.dev/images/v1/v/k/105907260-1557517637579rtx6uu7r.jpg,"U.S. markets recovered from their worst day of the year, after China's central bank rejected the U.S. Treasury's designation of the country being a currency manipulator and stabilized the yuan.",Positive,Article,CNBC,"Tue, 06 Aug 2019 17:59:00 -0400",
"Wall Street climbs more than 1% after China moves on yuan",https://www.reuters.com/article/us-usa-stocks/wall-street-climbs-more-than-1-after-china-moves-on-yuan-idUSKCN1UW18F,https://cdn.snapi.dev/images/v1/m/7/m02d20190806t2i1416074730rlynxnpef751bkw640.jpg,"U.S. stocks jumped more than 1 percent on Tuesday, bouncing back from a sharp sell-off the previous day as China stepped in to stabilize the yuan, easing concerns that currencies would be the next weapon in the U.S.-China trade war.",Positive,Article,Reuters,"Tue, 06 Aug 2019 16:29:25 -0400",
"Brent oil in bear market as China-U.S. trade tensions mount",https://www.reuters.com/article/us-global-oil/brent-oil-in-bear-market-as-china-u-s-trade-tensions-mount-idUSKCN1UW04M,https://cdn.snapi.dev/images/v1/9/u/m02d20190806t2i1415983459rlynxnpef7502uw640.jpg,"Oil prices fell more than 1% on Tuesday, with Brent crude settling near seven-month lows below $60 a barrel as trade tensions between the U.S. and China intensified worries about weakening global demand.",Negative,Article,Reuters,"Tue, 06 Aug 2019 16:07:00 -0400",oil
"Trump shrugs off trade war concerns; China warns of market chaos",https://www.reuters.com/article/us-usa-trade-china/trump-shrugs-off-trade-war-concerns-china-warns-of-market-chaos-idUSKCN1UW04S,https://cdn.snapi.dev/images/v1/d/g/m02d20190806t2i1415971825rlynxnpef75033w640.jpg,"U.S. President Donald Trump on Tuesday dismissed concerns over a protracted trade war with China, as Beijing warned that Washington's decision to label it a currency manipulator would lead to chaos in financial markets.",Negative,Article,Reuters,"Tue, 06 Aug 2019 11:23:51 -0400",
"China responds to US after Treasury designates Beijing as a currency manipulator",https://www.cnbc.com/2019/08/06/trade-war-china-responds-to-us-after-claim-of-being-a-currency-manipulator.html,https://cdn.snapi.dev/images/v1/d/f/104344624-rtx2hw2h.jpg,"The response from the People's Bank of China comes at a time of rapidly intensifying tensions between the world's two largest economies.",Negative,Article,CNBC,"Tue, 06 Aug 2019 06:36:00 -0400",
"U.N. members sign mediation convention to settle trade disputes",https://www.reuters.com/article/us-un-convention-singapore/u-n-members-sign-mediation-convention-to-settle-trade-disputes-idUSKCN1UX093,https://cdn.snapi.dev/images/v1/a/a/m02d20190807t2i1416259087rlynxnpef76057w640.jpg,"Members of the United Nations on Wednesday signed the Singapore Convention on Mediation, an agreement it hopes will make it easier to settle cross-border commercial disputes and stabilise trade relationships.",Positive,Article,Reuters,"Tue, 06 Aug 2019 23:25:37 -0400",
"Markets rebound after China indicates it will stabilize yuan",https://nypost.com/2019/08/06/markets-rebound-after-china-indicates-it-will-stabilize-yuan/,https://cdn.snapi.dev/images/v1/8/x/190806-yuan-markets-stabalizejpgquality90stripall.jpg,"Investors breathed a sigh of relief Tuesday as stocks rebounded after suffering their worst day of 2019 Monday. The S&P 500 snapped a six-day losing streak to end the day up 1.3 percent while the Dow Jones industrial average climbed 311.78 points, or 1.2 percent, to end the day near session highs at 26,029.52.",Positive,Article,"New York Post","Tue, 06 Aug 2019 22:01:38 -0400",
"Oil prices drop as US-China trade dispute stokes demand worries",https://www.cnbc.com/2019/08/07/oil-markets-us-china-trade-in-focus.html,https://cdn.snapi.dev/images/v1/b/e/102862329-rtx1k2hq.jpg,"Oil fell on Wednesday as the intensifying China-U.S. trade dispute stoked worries over demand, although a drop in U.S.",Negative,Article,CNBC,"Tue, 06 Aug 2019 21:43:00 -0400",oil
"China sets the yuan midpoint at 6.9996 per dollar, slightly weaker than expected",https://www.cnbc.com/2019/08/07/china-pboc-yuan-midpoint-on-7-august-2019.html,https://cdn.snapi.dev/images/v1/1/0/106064362-1565137946662gettyimages-611272452.jpeg,"A Reuters estimate had predicted that the People’s Bank of China would fix the yuan at 6.9994 against the dollar on Wednesday.",Neutral,Article,CNBC,"Tue, 06 Aug 2019 21:18:00 -0400",
"Fragile calm returns to stock markets as yuan steadies",https://www.reuters.com/article/us-global-markets/fragile-calm-returns-to-stock-markets-as-yuan-steadies-idUSKCN1UX03A,https://cdn.snapi.dev/images/v1/y/m/m02d20190807t2i1416226488rlynxnpef76024w640.jpg,"Asian shares steadied slightly on Wednesday as investors caught their breath from a searing week-long selloff, with steps taken by Chinese authorities to contain a sliding yuan helping calm fears of a full-blown Sino-U.S. trade and currency war.",Neutral,Article,Reuters,"Tue, 06 Aug 2019 21:08:18 -0400",
"A Weak Dollar Could Help the U.S. Getting One Isn’t So Easy.",https://www.nytimes.com/2019/08/06/business/a-weak-dollar-could-help-the-us-getting-one-isnt-so-easy.html,https://cdn.snapi.dev/images/v1/0/6/06dollar-articlelargejpgquality75autowebpdisableupscale.jpg,"President Trump has made no secret of his frustration that the United States dollar has strengthened against other currencies.",Negative,Article,NYTimes,"Tue, 06 Aug 2019 19:09:15 -0400",paywall
"Is a New Bear Market Forming in Oil?",https://247wallst.com/energy-business/2019/08/06/is-a-new-bear-market-forming-in-oil/,https://cdn.snapi.dev/images/v1/o/i/oil33.jpg,"Oil continues to be a drag on the markets. The Federal Reserve has been disappointed that inflation hasn’t been performing up to its target, and one such muting tool against inflation is stubbornly low oil prices translating into lower gasoline prices.",Negative,Article,"24/7 Wall Street","Tue, 06 Aug 2019 17:51:21 -0400",oil
"Market Volatility And China Tariffs Could Benefit Mexico As Top U.S. Trade Partner",https://www.benzinga.com/news/19/08/14212395/market-volatility-and-china-tariffs-could-benefit-mexico-as-top-u-s-trade-partner,https://cdn.snapi.dev/images/v1/n/c/china-15989-1920-30.jpg,"As the United States-China trade war frightened stock markets on August 5 into their worst day of the year, some analysts said Mexico could find a silver lining in increased trade exports.",Neutral,Article,Benzinga,"Tue, 06 Aug 2019 16:49:21 -0400",
"Dow Jones Today: Recovery, Sort Of",https://investorplace.com/2019/08/apple-disney-among-dow-leaders-today-but-conviction-is-needed/,https://cdn.snapi.dev/images/v1/d/o/dowjones1600-300x169.jpg,"Dow stocks, including AAPL and DIS, rebounded today, but some investors require more convincing",Positive,Article,InvestorPlace,"Tue, 06 Aug 2019 16:13:32 -0400",
"US Indexes Regain Ground Tuesday After Selloff",http://www.gurufocus.com/news/923189/us-indexes-regain-ground-tuesday-after-selloff,https://cdn.snapi.dev/images/v1/d/e/default8-2.jpg,"The Dow Jones Industrial Average closed at 26,029.52 on Tuesday with a gain of 311.78 points or 1.21%.",Positive,Article,GuruFocus,"Tue, 06 Aug 2019 16:08:29 -0400",
"Wall Street ends sharply higher as China moves on yuan",https://www.reuters.com/article/us-usa-stocks/wall-street-ends-sharply-higher-as-china-moves-on-yuan-idUSKCN1UW18F,https://cdn.snapi.dev/images/v1/p/c/m02d20190806t2i1416074730rlynxnpef751bkw640.jpg,"U.S. stocks ended more than 1 percent higher on Tuesday, bouncing back from a sharp sell-off the previous day as China stepped in to stabilize the yuan, easing concerns that currencies would be the latest weapon in the U.S.-China trade war.",Positive,Article,Reuters,"Tue, 06 Aug 2019 16:04:30 -0400",
"Trump dismisses trade war fears; China warns of market chaos",https://www.reuters.com/article/us-usa-trade-china/trump-dismisses-trade-war-fears-china-warns-of-market-chaos-idUSKCN1UW04S,https://cdn.snapi.dev/images/v1/u/m/m02d20190806t2i1415971825rlynxnpef75033w640.jpg,"U.S. President Donald Trump on Tuesday dismissed concerns over a protracted trade war with China despite a warning from Beijing that Washington's decision to label it a currency manipulator would lead to chaos in financial markets.",Negative,Article,Reuters,"Tue, 06 Aug 2019 16:03:22 -0400",
"Investors can hide out in domestic stocks from the China trade war",https://www.cnbc.com/2019/08/06/investors-can-hide-out-in-domestic-stocks-from-the-china-trade-war.html,https://cdn.snapi.dev/images/v1/l/a/106060358-1565021181666rtx72axl.jpg,"As the U.S.-China trade war continues to heat up, investors might want to hide in companies with 100% domestic sales, Goldman says.",Negative,Article,CNBC,"Tue, 06 Aug 2019 15:28:00 -0400",
"This will be Wall Street's new obsession as the trade war intensifies",https://www.cnbc.com/2019/08/06/this-will-be-wall-streets-new-obsession-as-the-trade-war-intensifies.html,https://cdn.snapi.dev/images/v1/y/w/20190810-fnp502.jpg,"Traders will take their cues from China's central bank and where it sets the midpoint for the yuan as U.S.-China tensions increase.",Negative,Article,CNBC,"Tue, 06 Aug 2019 15:26:00 -0400",
"Why I Didn’t Panic Yesterday",https://investorplace.com/2019/08/why-i-didnt-panic-yesterday-jcmm/,https://cdn.snapi.dev/images/v1/s/p/sp1600e-300x169.jpg,"Conditions are too oversold. We’re due for at least a reflex rally to relieve those oversold conditions.",Neutral,Article,InvestorPlace,"Tue, 06 Aug 2019 15:11:34 -0400",
"When It Comes To Oil Prices Today, It's China, China, China",https://www.forbes.com/sites/ellenrwald/2019/08/06/when-it-comes-to-oil-prices-today-its-china-china-china/,https://cdn.snapi.dev/images/v1/e/v/0x600.jpg,"The oil market moves today based on President Trump's tweets about trade negotiations and China's responses to U. S. actions.",Neutral,Article,Forbes,"Tue, 06 Aug 2019 14:41:45 -0400",oil
"Oil slightly lower as U.S.-China trade tensions weigh",https://www.reuters.com/article/us-global-oil/oil-slightly-lower-as-u-s-china-trade-tensions-weigh-idUSKCN1UW04M,https://cdn.snapi.dev/images/v1/o/r/104253169-gettyimages-505882540.jpg,"Oil prices fell slightly on Tuesday, with Brent crude remaining near seven-month lows just below $60 a barrel because of increasing trade tensions between China and the United States.",Negative,Article,Reuters,"Tue, 06 Aug 2019 14:39:28 -0400",oil
"S&P 500 and Nasdaq set to snap six-day losing streak",https://www.reuters.com/article/us-usa-stocks/sp-500-and-nasdaq-set-to-snap-six-day-losing-streak-idUSKCN1UW18F,https://cdn.snapi.dev/images/v1/g/j/m02d20190806t2i1416074730rlynxnpef751bkw640.jpg,"U.S. stocks rose on Tuesday as China stepped in to stabilize the yuan, soothing concerns that currencies would be the latest weapon in the long-drawn trade war, a day after Wall Street suffered their sharpest one-day percentage drops of the year.",Negative,Article,Reuters,"Tue, 06 Aug 2019 13:32:22 -0400",
"Fed's Bullard says it will take time to gauge the effects of the interest rate cut",https://www.cnbc.com/2019/08/06/feds-bullard-says-it-will-take-time-to-gauge-the-effects-of-the-interest-rate-cut.html,https://cdn.snapi.dev/images/v1/o/n/105023072-img-2171b.jpg,"Bullard has been one of the biggest advocates for a cut, but did not commit to further moves in a speech he delivered in New York.",Neutral,Article,CNBC,"Tue, 06 Aug 2019 13:07:00 -0400",
"'Mr. Wonderful' Kevin O'Leary says he's encouraged by Trump's 'new ideas' on China trade",https://www.cnbc.com/2019/08/06/kevin-oleary-says-hes-encouraged-by-trumps-new-ideas-on-china-trade.html,https://cdn.snapi.dev/images/v1/q/5/105577085-1542305652442img-3122rr.jpg,"“I like what this administration is doing by being ... trying new ideas” on trade, O’Leary said on “Fast Money Halftime Report.”",Positive,Article,CNBC,"Tue, 06 Aug 2019 12:58:00 -0400",
"Goldman Sachs, despite Monday's rout, still believes S&P 500 can add another 9% by year-end",https://www.cnbc.com/2019/08/06/goldman-sachs-despite-the-monday-rout-holds-sp-500-price-target.html,https://cdn.snapi.dev/images/v1/2/l/106063258-1565109249862david.jpg,"Goldman strategist David Kostin acknowledges the U.S.-China trade risk but says conditions are fundamentally ""still pretty much in line.",Neutral,Article,CNBC,"Tue, 06 Aug 2019 12:35:00 -0400",
"The stock market is exactly where it was one year ago",https://www.cnbc.com/2019/08/06/the-stock-market-is-exactly-where-it-was-one-year-ago.html,https://cdn.snapi.dev/images/v1/7/n/105918137-1558039328219gettyimages-1075229616.jpeg,"The stock market just landed back where it was exactly one year ago today.",Neutral,Article,CNBC,"Tue, 06 Aug 2019 12:32:00 -0400",
"Cramer on computer traders: 'Why don't they go work for NASA' instead of wrecking markets",https://www.cnbc.com/2019/08/06/cramer-on-computer-traders-work-for-nasa-instead-of-wrecking-markets.html,https://cdn.snapi.dev/images/v1/1/f/104326154-20150310-8614-1120.jpg,"CNBC's Jim Cramer blasts so-called pajama traders after the Dow opened positive on Tuesday following a tumultuous night.",Neutral,Article,CNBC,"Tue, 06 Aug 2019 12:32:00 -0400",cramer
"'We Will Eventually Get Into Stocks, Equities, Forex': SmartBotCoin Founder Talks Future Plans",https://www.benzinga.com/markets/cryptocurrency/19/08/14205073/we-will-eventually-get-into-stocks-equities-forex-smartbotcoin-founder-talks-future-plans,https://cdn.snapi.dev/images/v1/5/f/edw2-1.jpg,"Benzinga recently reported on the launch of SmartBotCoin, an advanced cryptocurrency trading platform intended to serve beginners and expert traders alike.",Neutral,Article,Benzinga,"Tue, 06 Aug 2019 12:16:22 -0400",
"One simple chart points to a stock market rebound",https://www.cnbc.com/2019/08/06/this-sp-500-chart-points-to-a-stock-market-rebound.html,https://cdn.snapi.dev/images/v1/i/d/105985506-1561412684037gettyimages-1151299070.jpeg,"Wall Street's big rebound from a days-long sell-off lost a little steam, but Bespoke's Paul Hickey says the upward march will resume.",Positive,Article,CNBC,"Tue, 06 Aug 2019 12:16:00 -0400",
"Five surprising new markets enter 2019's top 10 zip codes",https://www.cnbc.com/2019/08/06/five-new-markets-enter-2019s-top-ten-zip-codes.html,https://cdn.snapi.dev/images/v1/m/w/106063125-1565105354454ap-100420021543.jpg,"Affordability is driving more homebuyers away from big cities and toward smaller, unexpected markets. The suburbs of San Francisco and New York City used to be the most attractive, but now names like Omaha, NE and Rochester, NY are replacing them.",Neutral,Article,CNBC,"Tue, 06 Aug 2019 11:55:00 -0400",
"Trump is ignoring his aides and going it alone in the trade war now, Washington Post reports",https://www.cnbc.com/2019/08/06/trump-is-ignoring-his-aides-and-going-it-alone-in-the-trade-war-now-washington-post-reports.html,https://cdn.snapi.dev/images/v1/a/o/106060222-1565017754114rtx727ln.jpg,"Trump is trusting his instincts and ignoring the advice of his aides regarding issues surrounding the trade war with China, the Washington Post reported.",Negative,Article,CNBC,"Tue, 06 Aug 2019 10:54:00 -0400",
"'Not yet over' — Stocks have further to fall before the selling subsides, say chart analysts",https://www.cnbc.com/2019/08/06/not-yet-over-stocks-have-further-to-fall-before-the-selling-subsides-say-chart-analysts.html,https://cdn.snapi.dev/images/v1/o/k/104928147-gettyimages-896245900.jpg,"Experts point out that while the market has dropped sharply, it still has a long way to go before a sustainable bottom can be reached.",Negative,Article,CNBC,"Tue, 06 Aug 2019 10:28:00 -0400",
"4 Ways The Rate Cut Helps The Economy",https://www.forbes.com/sites/jamiehopkins/2019/08/06/ways-the-rate-cut-helps-the-economy/,https://cdn.snapi.dev/images/v1/b/d/0x600.jpg,"Rate cuts can have both a positive and negative impact on the economy. Check out four ways that rate cuts could positively impact the economy.",Positive,Article,Forbes,"Tue, 06 Aug 2019 10:03:00 -0400",
"Ron Insana: Crashing interest rates bring world closer to an economic abyss",https://www.cnbc.com/2019/08/06/crashing-interest-rates-bring-world-closer-to-an-economic-abyss.html,https://cdn.snapi.dev/images/v1/1/0/106060059-15650123930802019-07-31t192000z-548529618-hp1ef7v1hpclg-rtrmadp-3-usa-fed-stocks.jpg,"Watch debt, not stocks, for signals one where the economy is headed. Crashing interest rates around the world do not bode well.",Negative,Article,CNBC,"Tue, 06 Aug 2019 09:47:00 -0400",
"Trump still wants trade deal with China: adviser",https://www.reuters.com/article/us-usa-trade-china-kudlow/trump-still-wants-trade-deal-with-china-adviser-idUSKCN1UW1I5,https://cdn.snapi.dev/images/v1/s/t/m02d20190806t2i1416045156rlynxnpef7514vw640.jpg,"U.S. President Donald Trump wants to continue trade talks with China and the Trump administration is still planning to host a Chinese delegation for further talks in September, a top White House adviser said on Tuesday.",Positive,Article,Reuters,"Tue, 06 Aug 2019 09:36:00 -0400",
"Rebound After Rout: Positive Early Tone As China Currency Stabilizes",https://www.forbes.com/sites/jjkinahan/2019/08/06/rebound-after-rout-positive-early-tone-as-china-currency-stabilizes/,https://cdn.snapi.dev/images/v1/i/s/istock-2.jpg,"We’re back in the green this morning as the Yuan stabilized vs. the dollar earlier today.",Positive,Article,Forbes,"Tue, 06 Aug 2019 09:32:00 -0400",
"Stocks open higher as China contains fall in currency",https://www.marketwatch.com/story/stocks-open-higher-as-china-contains-fall-in-currency-2019-08-06,https://cdn.snapi.dev/images/v1/m/0/m02d20190805t2i1415747349rlynxnpef741tuw640.jpg,"U.S. stocks attempted a rebound Tuesday after China's central bank set a key currency level higher than expected, signalling an easing of tensions that sparked the worst trading day of 2019 Monday.",Positive,Article,"Market Watch","Tue, 06 Aug 2019 09:31:53 -0400",
"Former Federal Reserve Chairs Pen Op-Ed: 'America Needs An Independent Fed'",https://www.benzinga.com/general/politics/19/08/14209478/former-federal-reserve-chairs-pen-op-ed-america-needs-an-independent-fed,https://cdn.snapi.dev/images/v1/h/y/13896600480-eb61040d48-o.jpg,"A handful of former Federal Reserve leaders deplored the central bank's current leadership to act independently and implement policies in the best interests of the economy.",Neutral,Article,Benzinga,"Tue, 06 Aug 2019 09:26:08 -0400",
"Fed can't be expected to react to every twist of a trade war, Bullard says",https://www.marketwatch.com/story/fed-cant-be-expected-to-react-to-every-twist-of-a-trade-war-bullard-says-2019-08-06,https://cdn.snapi.dev/images/v1/8/s/8slf-1.jpg,"St. Louis Fed President James Bullard said Tuesday the U.S. central bank can't be expected to react to every twist and turn of a trade war.",Neutral,Article,"Market Watch","Tue, 06 Aug 2019 09:23:28 -0400",
"Trump economic advisor Larry Kudlow says China's economy is crumbling",https://www.cnbc.com/2019/08/06/trump-economic-advisor-larry-kudlow-says-chinas-economy-is-crumbling.html,https://cdn.snapi.dev/images/v1/1/0/105822863-1553885197048img-9308.jpg,"White House economic adviser Larry Kudlow spoke to CNBC on Tuesday.",Neutral,Article,CNBC,"Tue, 06 Aug 2019 09:20:00 -0400",
"German finance minister: U.S.-China trade conflict escalation would hurt economy more",https://www.reuters.com/article/us-usa-trade-china-germany/german-finance-minister-u-s-china-trade-conflict-escalation-would-hurt-economy-more-idUSKCN1UW1FV,https://cdn.snapi.dev/images/v1/6/r/m02d20190806t2i1416039975rlynxnpef7513dw640.jpg,"An escalation in a trade conflict between the United States and China will further damage the global economy, German Finance Minister Olaf Scholz warned on Tuesday, urging all sides to negotiate.",Negative,Article,Reuters,"Tue, 06 Aug 2019 09:18:42 -0400",
"Kudlow: Trump is flexible on China tariffs depending on how trade talks go",https://www.cnbc.com/2019/08/06/kudlow-trump-is-flexible-on-china-tariffs-depending-on-how-trade-talks-go.html,https://cdn.snapi.dev/images/v1/k/g/106057382-1564760309500gettyimages-1159150083.jpeg,"President Trump remains open to a trade deal with China, White House economic advisor Larry Kudlow tells CNBC.",Neutral,Article,CNBC,"Tue, 06 Aug 2019 09:13:00 -0400",
"Exclusive: China warns India of 'reverse sanctions' if Huawei is blocked - sources",https://www.reuters.com/article/us-huawei-india-exclusive/exclusive-china-warns-india-of-reverse-sanctions-if-huawei-is-blocked-sources-idUSKCN1UW1FF,https://cdn.snapi.dev/images/v1/m/0/m02d20190806t2i1416037480rlynxnpef7512nw640.jpg,"China has told India not to block its Huawei Technologies from doing business in the country, warning there could be consequences for Indian firms operating in China, sources with knowledge of the matter said.",Negative,Article,Reuters,"Tue, 06 Aug 2019 09:09:40 -0400",
"Jolted markets mark new 2019 milestones",https://www.reuters.com/article/us-global-markets-selloff-graphic/jolted-markets-mark-new-2019-milestones-idUSKCN1UW1DH,https://cdn.snapi.dev/images/v1/g/j/m02d20190806t2i1416034091rlynxnpef7511fw640.jpg,"Global financial markets have been jolted in recent days by yet another escalation in a trade war between the United States and China, with the resulting selloff and bid for safety pushing assets and markers into new territory for the year.",Neutral,Article,Reuters,"Tue, 06 Aug 2019 08:56:39 -0400",
"Ex-Treasury official warns Trump that China 'knows exactly what it's doing' with its currency",https://www.cnbc.com/2019/08/06/sarah-bloom-raskin-china-knows-what-it-is-doing-with-currency.html,https://cdn.snapi.dev/images/v1/l/i/101488293-450829547.jpg,"President Trump and Treasury should have had more discussions before declaring China a currency manipulator, says Sarah Bloom Raskin.",Neutral,Article,CNBC,"Tue, 06 Aug 2019 08:56:00 -0400",
"Gold ETFs are surging on trade fears—but steer clear of this group, says Kevin O'Leary",https://www.cnbc.com/2019/08/06/gold-etfs-surge-on-trade-fearsbut-steer-clear-kevin-oleary-says.html,https://cdn.snapi.dev/images/v1/w/t/102220371-170747783.jpg,"Gold-based exchange-traded funds have soared along with the price of the precious metal itself as U.S. stocks tumble on escalating trade worries.",Negative,Article,CNBC,"Tue, 06 Aug 2019 08:30:00 -0400",gold
"Trump says U.S. economy 'in a very strong position'",https://www.reuters.com/article/us-usa-trade-china-trump/trump-says-u-s-economy-in-a-very-strong-position-idUSKCN1UW1B9,https://cdn.snapi.dev/images/v1/m/0/m02d20190806t2i1416024167rlynxnpef750z7w640.jpg,"U.S. President Donald Trump on Tuesday dismissed concerns over a protracted trade war with China, saying the United States was ""in a very strong position,"" a day after his administration ratcheted up tensions by labeling Beijing a currency manipulator.",Positive,Article,Reuters,"Tue, 06 Aug 2019 08:18:35 -0400",
"Trump says US in 'strong position' and money 'pouring' in from China as trade war intensifies",https://www.cnbc.com/2019/08/06/trump-says-us-in-strong-position-and-money-pouring-in-from-china-as-trade-war-intensifies.html,https://cdn.snapi.dev/images/v1/s/n/105451929-1536941341663gettyimages-1033020270.jpeg,"“Massive amounts of money from China ... is pouring into the United States for reasons of safety, investment, and interest rates!” Trump writes on Twitter.",Negative,Article,CNBC,"Tue, 06 Aug 2019 08:03:00 -0400",
"You don't have to be an economist to understand the Federal Reserve",https://www.cnbc.com/2019/08/06/in-case-you-are-wondering-heres-what-happens-when-the-fed-cuts-rates.html,https://cdn.snapi.dev/images/v1/r/x/104407562-sarah-bloom-raskin.jpg,"Here's what the Federal Reserve actually does and how it affects you.",Neutral,Article,CNBC,"Tue, 06 Aug 2019 08:00:00 -0400",
