title,news_url,image_url,text,sentiment,type,source_name,date,topics
"Over Fed minutes, a Trump-shaped shadow",https://www.reuters.com/article/us-usa-fed-trump/over-fed-minutes-a-trump-shaped-shadow-idUSKCN1VB2MC,https://cdn.snapi.dev/images/v1/a/i/m02d20190821t2i1421368410rlynxnpef7k1xvw640.jpg,"The one thing Federal Reserve officials were in broad agreement about at their last meeting was this: to not tip their hands about what happens next.",Neutral,Article,Reuters,"Wed, 21 Aug 2019 19:10:52 -0400",
"Bond market yield curve inverts, signaling Fed may be too slow to cut rates, risks recession",https://www.cnbc.com/2019/08/21/bond-market-signaling-that-fed-may-be-too-slow-to-cut-rates.html,https://cdn.snapi.dev/images/v1/m/i/106057368-1564759797325powell11.jpg,"After the Fed released minutes of its last meeting, the bond market signaled it fears the Fed will not be aggressive enough with its rate cutting.",Negative,Article,CNBC,"Wed, 21 Aug 2019 16:34:00 -0400",
"Yield Curve Briefly Inverts For Second Time In A Week",https://www.benzinga.com/news/19/08/14308806/yield-curve-briefly-inverts-for-second-time-in-a-week,https://cdn.snapi.dev/images/v1/q/q/3eeust-1-1.jpg,"The spread between the yield on the 10-year and 2-year Treasury notes turned briefly negative Wednesday for the second time in the last one-week period.",Negative,Article,Benzinga,"Wed, 21 Aug 2019 16:28:49 -0400",
"Wall Street gains after upbeat retail earnings",https://www.reuters.com/article/us-usa-stocks/wall-street-gains-after-upbeat-retail-earnings-idUSKCN1VB1AN,https://cdn.snapi.dev/images/v1/k/s/stock-exchange-1376107-1920-15.jpg,"Wall Street's main indexes rose on Wednesday as upbeat earnings from retailers pointed to strength in U.S. consumer demand and held their gains after minutes from the Federal Reserve's meeting last month showed that policymakers had debated a more aggressive rate cut.",Positive,Article,Reuters,"Wed, 21 Aug 2019 16:04:52 -0400",
"Trump says the Fed is the 'only problem' with economy, calls Powell 'a golfer who can't putt'",https://www.cnbc.com/2019/08/21/trump-says-the-fed-is-the-only-problem-with-economy-calls-powell-a-golfer-who-cant-putt.html,https://cdn.snapi.dev/images/v1/w/q/106088495-1566328741904rts2n780.jpg,"He proclaimed the economy healthy in a pair of tweets Wednesday, saying the only thing holding growth back was the Federal Reserve.",Negative,Article,CNBC,"Wed, 21 Aug 2019 08:55:00 -0400",
"Yield curve briefly inverts again with 2-year Treasury yield topping 10-year rate",https://www.cnbc.com/2019/08/21/us-bonds-fed-meeting-minutes-in-focus-ahead-of-g7-summit.html,https://cdn.snapi.dev/images/v1/c/w/105802039-1553007636265rts2dtjq.jpg,"Market focus is largely attuned to the Federal Reserve, with the U.S. central bank scheduled to publish its latest meeting minutes.",Neutral,Article,CNBC,"Wed, 21 Aug 2019 02:45:00 -0400",
"Oil inches higher after US crude stocks draw down, economic worries weigh",https://www.cnbc.com/2019/08/22/oil-markets-us-crude-stocks-global-economy-in-focus.html,https://cdn.snapi.dev/images/v1/q/9/106040508-1564074414414rtx7107y.jpg,"Oil prices edged higher on Thursday after a draw down in U.S. crude inventories, but lingering concerns over the global economy and a build-up in U.S.",Positive,Article,CNBC,"Wed, 21 Aug 2019 23:49:00 -0400",oil
"Asia shares sit still, await clarity on Fed policy",https://www.reuters.com/article/us-global-markets/asia-shares-sit-still-await-clarity-on-fed-policy-idUSKCN1VC01P,https://cdn.snapi.dev/images/v1/t/n/m02d20190822t2i1421386260rlynxnpef7l00vw640.jpg,"Asian shares went flat on Thursday as uncertainty over the outlook for both U.S. interest rates and the chance of global fiscal stimulus sucked the life out of markets.",Neutral,Article,Reuters,"Wed, 21 Aug 2019 23:31:05 -0400",
"Oil inches higher after U.S. crude stocks drawdown, economic worries weigh",https://www.reuters.com/article/us-global-oil/oil-inches-higher-after-u-s-crude-stocks-drawdown-economic-worries-weigh-idUSKCN1VC03W,https://cdn.snapi.dev/images/v1/6/y/m02d20190822t2i1421397852rlynxnpef7l02ww640.jpg,"Oil prices edged higher on Thursday after a drawdown in U.S. crude inventories, but lingering concerns over the global economy and a build-up in U.S.",Positive,Article,Reuters,"Wed, 21 Aug 2019 23:01:44 -0400",oil
"Fed Chair Jerome Powell has chance to prove he has guts",https://nypost.com/2019/08/21/fed-chair-jerome-powell-has-chance-to-prove-he-has-guts/,https://cdn.snapi.dev/images/v1/f/1/jerome-powelljpgquality90stripall.jpg,"On Friday, Federal Reserve Chairman Jerome “Jay” Powell will have the chance to prove he has guts. For months, President Trump has been bullying the guy he picked to run the Fed, insisting that the nation needs lower interest rates while, at the same time, saying the US economy is doing just fine.",Neutral,Article,"New York Post","Wed, 21 Aug 2019 22:18:54 -0400",
"Oil prices rise after U.S. crude stocks draw",https://www.reuters.com/article/us-global-oil/oil-prices-rise-after-u-s-crude-stocks-draw-idUSKCN1VC03W,https://cdn.snapi.dev/images/v1/9/m/m02d20190822t2i1421397852rlynxnpef7l02ww640.jpg,"Oil prices rose on Thursday following a drawdown in U.S. crude inventories, but gains in fuel inventories and persistent concerns over the global economy and future demand outlook capped gains.",Positive,Article,Reuters,"Wed, 21 Aug 2019 21:23:47 -0400",oil
"Asia shares find support, still waiting on stimulus",https://www.reuters.com/article/us-global-markets/asia-shares-find-support-still-waiting-on-stimulus-idUSKCN1VC01P,https://cdn.snapi.dev/images/v1/m/0/m02d20190822t2i1421386260rlynxnpef7l00vw640.jpg,"Asian shares edged ahead on Thursday after Wall Street got a boost from strong retail results, while bonds retreated as U.S. policy makers sounded conflicted on whether to cut interest rates as sharply as markets were wagering.",Positive,Article,Reuters,"Wed, 21 Aug 2019 20:29:27 -0400",
"U.S. lawmakers say tariffs on EU olive oil pit Trump trade policy against demand",https://www.reuters.com/article/us-usa-olive-oil-eu/u-s-lawmakers-say-tariffs-on-eu-olive-oil-pit-trump-trade-policy-against-demand-idUSKCN1VB2HQ,https://cdn.snapi.dev/images/v1/u/l/m02d20190821t2i1421343126rlynxnpef7k1uow640.jpg,"U.S. lawmakers on Wednesday urged the U.S. Trade Representative's Office not to impose new import tariffs on European olive oil, warning they could lead to an olive oil shortage and higher prices in the United States.",Neutral,Article,Reuters,"Wed, 21 Aug 2019 17:25:33 -0400",oil
"Stocks rise with focus on stimulus; U.S. yield curve briefly inverts",https://www.reuters.com/article/us-global-markets/stocks-rise-with-focus-on-stimulus-u-s-yield-curve-briefly-inverts-idUSKCN1VB02J,https://cdn.snapi.dev/images/v1/n/l/m02d20190821t2i1421312144rlynxnpef7k1qmw640.jpg,"A global equities gauge rose on Wednesday for a third day in four as bets on more economic stimulus overcame, for now, worries over the rising prospect of a global recession.",Positive,Article,Reuters,"Wed, 21 Aug 2019 16:54:37 -0400",
"Who Will Survive The Retail Apocalypse?",http://www.zacks.com/stock/news/481609/who-will-survive-the-retail-apocalypse,https://cdn.snapi.dev/images/v1/5/1/51.jpg,"Amazon and its ecommerce wave have swallowed up 10s of thousands of brick-and-mortar stores in the retail apocalypse. Retailers everywhere are scrambling to find their niche with the shifting consumer.",Neutral,Article,"Zacks Investment Research","Wed, 21 Aug 2019 16:30:00 -0400",
"Stock Market Today: Tesla Runs Into Headwinds, Fed Says Things Are Fine",https://investorplace.com/2019/08/stock-market-today-tesla-runs-into-headwinds-fed-says-things-are-fine/,https://cdn.snapi.dev/images/v1/g/h/etf35.jpg,"Lowe's and Target popped on strong earnings news, and lower interest rates are starting to take effect.
The post Stock Market Today: Tesla Runs Into Headwinds, Fed Says Things Are Fine appeared first on InvestorPlace.",Neutral,Article,InvestorPlace,"Wed, 21 Aug 2019 16:26:50 -0400",
"Fed Minutes Suggest Policy Divisions Unlikely To End Soon",https://www.forbes.com/sites/simonmoore/2019/08/21/fed-minutes-suggest-policy-divisions-unlikely-to-end-soon/,https://cdn.snapi.dev/images/v1/3/0/0x600.jpg,"What we learned from the July Fed minutes and the potential conflict between the view of the markets and that of policy makers.",Neutral,Article,Forbes,"Wed, 21 Aug 2019 15:55:00 -0400",
"US Indexes Rebound to Close Higher Wednesday (Aug 21)",http://www.gurufocus.com/news/933072/us-indexes-rebound-to-close-higher-wednesday,https://cdn.snapi.dev/images/v1/n/y/nyse42d-1.jpg,"The Dow Jones Industrial Average closed at 26,202.73 on Wednesday with a gain of 240.29 points or 0.93%.",Positive,Article,GuruFocus,"Wed, 21 Aug 2019 15:50:08 -0400",
"Stocks rise with focus on stimulus; U.S. yield curve flat",https://www.reuters.com/article/us-global-markets/stocks-rise-with-focus-on-stimulus-u-s-yield-curve-flat-idUSKCN1VB02J,https://cdn.snapi.dev/images/v1/m/g/m02d20190821t2i1421312144rlynxnpef7k1qmw640.jpg,"A global equities gauge rose on Wednesday for a third day in four as bets on more economic stimulus overcame, for now, worries over the rising prospect of a global recession.",Positive,Article,Reuters,"Wed, 21 Aug 2019 15:26:04 -0400",
"Recent stock and bond market volatility is mostly technical, rather than fundamental",https://www.marketwatch.com/story/recent-stock-and-bond-market-volatility-is-mostly-technical-rather-than-fundamental--jp-morgan-2019-08-21,https://cdn.snapi.dev/images/v1/a/z/bank40.jpg,"J.P. Morgan said Wednesday research by its interest rate analysts suggests the market volatility since Aug. 14, when the yield on the 10-year Treasury note dipped below the 2-year yield, and the Dow Jones Industrial Average DJIA, +0.93% tumbled 800 points, has been cause more technical than fundamental.",Neutral,Article,"Market Watch","Wed, 21 Aug 2019 15:23:42 -0400",
"5 Most Important Countries To Watch For Oil Markets",https://www.forbes.com/sites/ellenrwald/2019/08/21/5-most-important-countries-to-watch-for-oil-markets/,https://cdn.snapi.dev/images/v1/j/g/0x600.jpg,"These 5 countries make the oil market move.",Neutral,Article,Forbes,"Wed, 21 Aug 2019 14:56:11 -0400",oil
"Fed Affirms 'Midcycle Adjustment,' See No 'Pre-Set Course' For Cuts",https://www.benzinga.com/news/19/08/14307989/fed-affirms-midcycle-adjustment-see-no-pre-set-course-for-cuts,https://cdn.snapi.dev/images/v1/d/w/federal-reserve-14-9.jpg,"Minutes from the most recent Federal resevre meeting show that members affirm a ""midcycle adjustment"" and see no ""pre-set course"" for future interest rate cuts.",Neutral,Article,Benzinga,"Wed, 21 Aug 2019 14:07:55 -0400",
"Fed Was Divided About Interest Rate Cut",https://www.nytimes.com/2019/08/21/business/economy/federal-reserve-minutes.html,https://cdn.snapi.dev/images/v1/b/q/merlin-157757232-9d06efcf-25b5-4ad0-95b2-882e97ad85b0-articlelargejpgquality75autowebpdisableupscale.jpg,"Fed officials were split in their decision over whether to cut rates and by how much.",Neutral,Article,NYTimes,"Wed, 21 Aug 2019 14:06:49 -0400",paywall
"Fed debated bigger rate cut, wanted to avoid appearing on path for more cuts",https://www.reuters.com/article/us-usa-fed-minutes/fed-debated-bigger-rate-cut-wanted-to-avoid-appearing-on-path-for-more-cuts-idUSKCN1VB27D,https://cdn.snapi.dev/images/v1/6/j/m02d20190821t2i1421291373rlynxnpef7k1l5w640.jpg,"The Federal Reserve debated cutting interest rates more aggressively at its last meeting, although central bankers were united in wanting to avoid the appearance of being on a path to more rate cuts, records from the meeting showed.",Neutral,Article,Reuters,"Wed, 21 Aug 2019 14:04:52 -0400",
"Fed sees tariffs as 'persistent headwind' to economic growth",https://www.cnbc.com/2019/08/21/fed-sees-tariffs-as-persistent-headwind-to-economic-growth.html,https://cdn.snapi.dev/images/v1/p/4/etf16.jpg,"Federal Reserve members worried over future growth are highly concerned about the U.S.-China tariff battle",Negative,Article,CNBC,"Wed, 21 Aug 2019 14:02:00 -0400",
"Fed members affirm 'midcycle adjustment,' see no 'pre-set course' for cuts, minutes show",https://www.cnbc.com/2019/08/21/federal-reserve-releases-minutes-from-july-meeting.html,https://cdn.snapi.dev/images/v1/z/d/106052751-1564623137916rtx71q0z.jpg,"Fed officials who voted to lower interest rates three weeks ago agreed that the move shouldn’t be viewed as part of a “pre-set course” for future cuts.",Neutral,Article,CNBC,"Wed, 21 Aug 2019 14:00:00 -0400",
"Trump raises pressure on Federal Reserve to cut interest rates",https://www.theguardian.com/business/2019/aug/21/trump-raises-pressure-on-federal-reserve-to-cut-interest-rates,https://cdn.snapi.dev/images/v1/a/j/2062jpgwidth460quality85autoformatfitmaxs7ee574d20b10141230a3bca673c11fdb.jpg,"President launches new attack on Jerome Powell, the man he picked to run US central bank",Negative,Article,"The Guardian","Wed, 21 Aug 2019 13:52:06 -0400",
"Global stocks lead risk rally ahead of Fed minutes",https://www.reuters.com/article/us-global-markets/global-stocks-lead-risk-rally-ahead-of-fed-minutes-idUSKCN1VB02J,https://cdn.snapi.dev/images/v1/9/q/m02d20190821t2i1421152610rlynxnpef7k0lsw640.jpg,"A global equities gauge rose on Wednesday for a third day in four as bets on more economic stimulus overcame, for now, worries over the rising prospect of a global recession.",Neutral,Article,Reuters,"Wed, 21 Aug 2019 13:34:24 -0400",
"Bitcoin Prices Suffer Sharp Drop As Momentum Fades",https://www.forbes.com/sites/cbovaird/2019/08/21/bitcoin-prices-suffer-sharp-drop-as-momentum-fades/,https://cdn.snapi.dev/images/v1/n/w/0x600.jpg,"Bitcoin has been suffering from lackluster sentiment, as evidenced by The Fear & Greed Index. When will investors become more optimistic?",Negative,Article,Forbes,"Wed, 21 Aug 2019 13:15:00 -0400",crypto
"An Update On Havilah Resources",https://seekingalpha.com/article/4287112-update-havilah-resources,https://cdn.snapi.dev/images/v1/1/6/16hars-1.jpg,"Havilah Resources recently announced a landmark A$100m deal which, if approved, can help bring their massive resources more rapidly towards production.",Neutral,Article,"Seeking Alpha","Wed, 21 Aug 2019 12:37:53 -0400",
"U.S. home sales rise, boosted by lower mortgage rates",https://www.reuters.com/article/us-usa-economy-housing/u-s-home-sales-rise-boosted-by-lower-mortgage-rates-idUSKCN1VB1MC,https://cdn.snapi.dev/images/v1/m/0/m02d20190821t2i1421263057rlynxnpef7k17tw640.jpg,"U.S. home sales rose more than expected in July, boosted by lower mortgage rates and a strong labor market, signs the Federal Reserve's shift toward lower interest rates was supporting the economy.",Positive,Article,Reuters,"Wed, 21 Aug 2019 12:02:13 -0400",
"BR Brands Acquires Mary's Brands, Closes Series A Capital Raise",https://www.benzinga.com/markets/cannabis/19/08/14306915/br-brands-acquires-marys-brands-closes-series-a-capital-raise,https://cdn.snapi.dev/images/v1/m/a/marys-patch-group3-web.jpg,"BR Brands, LLC, a consumer packaged goods company serving cannabis industry, announced Wednesday the first closing of its Series A capital raise as well as the acquisition of Mary’s Brands.",Positive,Article,Benzinga,"Wed, 21 Aug 2019 11:59:08 -0400",manda
"U.S. markets regulator votes to propose new guidelines on shareholder advisers",https://www.reuters.com/article/us-usa-sec-proxy-advisors/u-s-markets-regulator-votes-to-propose-new-guidelines-on-shareholder-advisers-idUSKCN1VB1Q0,https://cdn.snapi.dev/images/v1/o/o/m02d20190821t2i1421236845rlynxnpef7k18aw640.jpg,"The U.S. Securities and Exchange Commission on Wednesday voted to publish new guidance that aims to clarify how investors and advisory firms that vote on their behalf should cast their votes in corporate elections on issues like pay and diversity.",Neutral,Article,Reuters,"Wed, 21 Aug 2019 11:46:33 -0400",
"The 13F Parade: Syncopated, Frenetic, But Dull",https://www.forbes.com/sites/martinsosnoff/2019/08/21/the-13f-parade--syncopated-frenetic-but-dull/,https://cdn.snapi.dev/images/v1/1/5/15spfr-1.jpg,"After scrolling through dozens of 13Fs, bored, the sole surprise was the serious new position taken in Berkshire Hathaway by Pershing Square Capital Management.",Neutral,Article,Forbes,"Wed, 21 Aug 2019 11:33:48 -0400",
"'You prepare for war': how one U.S. firm tried escaping Trump's China tariffs",https://www.cnbc.com/2019/08/21/how-one-us-firm-tried-escaping-trumps-china-tariffs.html,https://cdn.snapi.dev/images/v1/e/t/104041641-gettyimages-609468920.jpg,"Capstone International Hong Kong CEO Larry Sloven is just one of thousands of entrepreneurs who have been forced by the trade war to upend their business operations in China.",Neutral,Article,CNBC,"Wed, 21 Aug 2019 11:32:00 -0400",
"'Don't short a dull tape' – Old Wall Street adage may explain the stock market's comeback",https://www.cnbc.com/2019/08/21/dont-short-a-dull-market-adage-comes-into-play-as-trading-slows.html,https://cdn.snapi.dev/images/v1/5/h/106086204-1566231340188rtx71ykr.jpg,"Trading volumes this week are well below their recent averages and that means this comeback may be suspect.",Positive,Article,CNBC,"Wed, 21 Aug 2019 11:28:00 -0400",
"World stocks lead risk rally amid stimulus, recession talk",https://www.reuters.com/article/us-global-markets/world-stocks-lead-risk-rally-amid-stimulus-recession-talk-idUSKCN1VB02J,https://cdn.snapi.dev/images/v1/a/f/m02d20190821t2i1421152610rlynxnpef7k0lsw640.jpg,"A global equities gauge rose on Wednesday for a third day in four as bets on more economic stimulus overcame, for now, worries over the rising prospect of a global recession.",Neutral,Article,Reuters,"Wed, 21 Aug 2019 11:26:50 -0400",
"WeWork’s IPO Filing Is a 'Masterpiece of Obfuscation'",http://www.gurufocus.com/news/932514/weworks-ipo-filing-is-a-masterpiece-of-obfuscation,https://cdn.snapi.dev/images/v1/1/4/14wwco-1.jpg,"Earlier, I wrote a piece about WeWork’s initial public offering filing and discussed some of the dubious links between CEO Adam Neumann and the company that he founded.",Negative,Article,GuruFocus,"Wed, 21 Aug 2019 11:09:20 -0400",
"Napier Port Shares Begin Trading On The New Zealand Stock Exchange",https://www.benzinga.com/news/19/08/14304037/napier-port-shares-begin-trading-on-the-new-zealand-stock-exchange,https://cdn.snapi.dev/images/v1/n/6/container-1638068-1920-101.jpg,"Napier Port, located in Hawke's Bay on the North Island of New Zealand, has begun trading on the New Zealand Stock Exchange (NZH) at an offer price of N$2.60 (US$1.66), raising NZ$234 million (US$149.94 million).",Neutral,Article,Benzinga,"Wed, 21 Aug 2019 10:48:32 -0400",
"U.S. markets regulator proposes new guidelines on shareholder advisers",https://www.reuters.com/article/us-usa-sec-proxy-advisors/u-s-markets-regulator-proposes-new-guidelines-on-shareholder-advisers-idUSKCN1VB1Q0,https://cdn.snapi.dev/images/v1/w/z/m02d20190821t2i1421236845rlynxnpef7k18aw640.jpg,"The U.S. Securities and Exchange Commission on Wednesday proposed new guidance that aims to clarify how investors and advisory firms that vote on their behalf should cast their votes in corporate elections on issues like pay and diversity.",Neutral,Article,Reuters,"Wed, 21 Aug 2019 10:43:42 -0400",
"3 Index Funds to Buy on Hopes of Global Economic Stimulus",http://www.zacks.com/stock/news/481205/3-index-funds-to-buy-on-hopes-of-global-economic-stimulus,https://cdn.snapi.dev/images/v1/m/a/marj82-1.jpg,"Fresh economic stimulus by major countries could push market indexes in the months ahead.",Positive,Article,"Zacks Investment Research","Wed, 21 Aug 2019 10:36:00 -0400",
"National Bank of Canada (NTIOF) Earnings Expected to Grow: What to Know Ahead of Next Week's Release",http://www.zacks.com/stock/news/481188/national-bank-of-canada-ntiof-earnings-expected-to-grow-what-to-know-ahead-of-next-weeks-release,https://cdn.snapi.dev/images/v1/1/3/13nabc-1.jpg,"National Bank of Canada (NTIOF) doesn't possess the right combination of the two key ingredients for a likely earnings beat in its upcoming report. Get prepared with the key expectations.",Neutral,Article,"Zacks Investment Research","Wed, 21 Aug 2019 10:30:34 -0400",earnings
"Get Ready for a Volatile Fourth Quarter",https://www.investopedia.com/get-ready-for-a-volatile-fourth-quarter-4768206,https://cdn.snapi.dev/images/v1/1/0/106037929-1563998368326etf.jpg,"Complacency has returned to the summer market, setting the stage for a volatile fourth quarter that could rival 2018.",Negative,Article,Investopedia,"Wed, 21 Aug 2019 09:51:21 -0400",
"Trump heaps pressure on Fed and its chairman Powell to cut rates",https://www.reuters.com/article/us-usa-fed-trump/trump-heaps-pressure-on-fed-and-its-chairman-powell-to-cut-rates-idUSKCN1VB1I2,https://cdn.snapi.dev/images/v1/v/q/m02d20190821t2i1421212114rlynxnpef7k118w640.jpg,"President Donald Trump on Wednesday continued to pressure the Federal Reserve and the central bank's chairman to lower interest rates, saying its policies were hampering U.S. growth and reducing the country's ability to compete economically.",Negative,Article,Reuters,"Wed, 21 Aug 2019 09:32:48 -0400",
"Dow jumps more than 200-points at the open as Target's stock heads to all-time high",https://www.marketwatch.com/story/dow-jumps-more-than-200-points-at-the-open-as-targets-stock-heads-to-all-time-high-2019-08-21,https://cdn.snapi.dev/images/v1/c/x/dowjones1600d-300x169.jpg,"U.S. stocks opened solidly higher on Wednesday as upbeat quarterly results from retailers Target and Lowe's helped to support early buying.",Positive,Article,"Market Watch","Wed, 21 Aug 2019 09:32:34 -0400",
"New Accounting Rules Limit Transparency and Harm Investors",https://www.forbes.com/sites/greatspeculations/2019/08/21/new-accounting-rules-limit-transparency-and-harm-investors/,https://cdn.snapi.dev/images/v1/f/v/0x600.jpg,"We raise awareness for both regulators and investors of how recent changes in disclosures affect average investors.",Negative,Article,Forbes,"Wed, 21 Aug 2019 09:12:01 -0400",
"Morgan Stanley: Risk of a global recession is 'high and rising'",https://www.cnbc.com/2019/08/21/morgan-stanley-risk-of-a-global-recession-is-high-and-rising.html,https://cdn.snapi.dev/images/v1/1/0/104161853-gettyimages-51619057.jpg,"Morgan Stanley warns that ""the wheels for a slowdown are in motion,"" adding that a slowdown in the manufacturing sector is spreading.",Negative,Article,CNBC,"Wed, 21 Aug 2019 08:56:00 -0400",
"Hedge funds are dumping tech stocks for health care",https://www.cnbc.com/2019/08/21/hedge-funds-are-dumping-tech-stocks-for-health-care.html,https://cdn.snapi.dev/images/v1/w/9/106083903-1565988707468nyse.jpg,"Hedge funds are steering away from battered tech and semiconductor stocks, while bottom-fishing in health care names, according to Goldman Sachs.",Negative,Article,CNBC,"Wed, 21 Aug 2019 08:42:00 -0400",
"Consumer strength is 'deteriorating before our very eyes,' Wall Street bear David Rosenberg warns",https://www.cnbc.com/2019/08/21/consumer-spending-is-a-bubble-waiting-to-burst-david-rosenberg-warns.html,https://cdn.snapi.dev/images/v1/p/p/105598220-1543443410181gettyimages-854153614.jpg,"Gluskin Sheff's David Rosenberg predicts one of the strongest parts of the U.S. economy will disappoint Wall Street and lead to a market meltdown.",Neutral,Article,CNBC,"Wed, 21 Aug 2019 08:27:00 -0400",
"Futures gain on upbeat Target, Lowe's earnings; Fed minutes eyed",https://www.reuters.com/article/us-usa-stocks/futures-gain-on-upbeat-target-lowes-earnings-fed-minutes-eyed-idUSKCN1VB1AN,https://cdn.snapi.dev/images/v1/w/q/m02d20190821t2i1421189134rlynxnpef7k0vkw640.jpg,"U.S. stock index futures rose on Wednesday as upbeat earnings reports from retailers Lowe's and Target reflected robust consumer demand, helping ease some concerns around slowing economic growth.",Positive,Article,Reuters,"Wed, 21 Aug 2019 07:43:40 -0400",
