title,news_url,image_url,text,sentiment,type,source_name,date,topics
"Stocks, dollar rise as U.S.-China trade rhetoric softens",https://www.reuters.com/article/us-global-markets/stocks-dollar-rise-as-u-s-china-trade-rhetoric-softens-idUSKCN1VF105,https://cdn.snapi.dev/images/v1/7/t/m02d20190826t2i1423072362rlynxnpef7p14tw640.jpg,"A global gauge of equities edged higher on Monday and the dollar rebounded after U.S. President Donald Trump said Chinese officials had contacted Washington about resuming trade negotiations.",Positive,Article,Reuters,"Mon, 26 Aug 2019 16:40:25 -0400",
"A sell-off worse than December can arrive in a week, says analyst who is predicting 'Lehman-like' drop",https://www.cnbc.com/2019/08/26/lehman-like-drop-nomuras-masanari-takada-warns-it-could-happen-in-a-week.html,https://cdn.snapi.dev/images/v1/1/0/106078523-1565787184284gettyimages-1161343278.jpeg,"Nomura macro and quant strategist Masanari Takada is sticking with his bold call for a ""Lehman-like"" plunge as market sentiment shows no signs of improving.",Negative,Article,CNBC,"Mon, 26 Aug 2019 14:00:00 -0400",
"Trump sees possible U.S.-EU trade deal that would avert car tariffs",https://www.reuters.com/article/us-usa-trade-eu/trump-sees-possible-u-s-eu-trade-deal-that-would-avert-car-tariffs-idUSKCN1VG1YO,https://cdn.snapi.dev/images/v1/g/y/m02d20190826t2i1423033924rlynxnpef7p199w640.jpg,"U.S. President Donald Trump on Monday said he thinks the United States will be able to reach a fair trade agreement with the European Union without imposing threatened tariffs on car imports, offering a potential lifeline to German carmakers.",Neutral,Article,Reuters,"Mon, 26 Aug 2019 13:47:59 -0400",
"US and France reach a compromise on France’s tax on tech giants",https://techcrunch.com/2019/08/26/us-and-france-reach-a-compromise-on-frances-tax-on-tech-giants/,https://cdn.snapi.dev/images/v1/g/e/gettyimages-1164162643jpgw600.jpg,"During a new briefing at the Group of 7 summit, French President Emmanuel Macron announced that U.S. President Donald Trump and Macron have agreed on a compromise regarding the controversial tax on tech giants.",Positive,Article,TechCrunch,"Mon, 26 Aug 2019 12:20:36 -0400",
"Cramer warns investors that believing China over Trump on trade is dangerous and costly",https://www.cnbc.com/2019/08/26/cramer-warns-investors-believing-china-over-trump-on-trade-dangerous.html,https://cdn.snapi.dev/images/v1/b/z/106049621-1564531713546img-2688r.jpg,"""I'm aghast we trust the People's Republic of China more than we trust the White House,"" says CNBC's Jim Cramer.",Negative,Article,CNBC,"Mon, 26 Aug 2019 10:29:00 -0400",cramer
"Market Bounces Back After Trump Suggests 'Very Positive Development' In Trade War",https://www.benzinga.com/news/19/08/14326338/market-bounces-back-after-trump-suggests-very-positive-development-in-trade-war,https://cdn.snapi.dev/images/v1/4/8/48617423371-95676236f5-o.jpg,"U.S. stocks were poised to rebound on Monday after an eventful G-7 meeting may have trade negotiations between the U.S. and China back on track for now.",Positive,Article,Benzinga,"Mon, 26 Aug 2019 09:52:19 -0400",
"Wall St. to open higher after Trump eases stance on China trade",https://www.reuters.com/article/us-usa-stocks/wall-st-to-open-higher-after-trump-eases-stance-on-china-trade-idUSKCN1VG18K,https://cdn.snapi.dev/images/v1/m/0/m02d20190826t2i1422944926rlynxnpef7p0s5w640.jpg,"Wall Street was set to open higher on Monday as U.S. President Donald Trump moved to ease trade tensions with China, soothing investor nerves after intense feuding between the world's top two economies last week sent stocks into a tailspin.",Positive,Article,Reuters,"Mon, 26 Aug 2019 09:18:13 -0400",
"Trump, asked if could delay China tariffs, says: 'Anything is possible'",https://www.reuters.com/article/us-g7-summit-china-trade/trump-asked-if-could-delay-china-tariffs-says-anything-is-possible-idUSKCN1VG0X5,https://cdn.snapi.dev/images/v1/u/k/m02d20190826t2i1422919012rlynxnpef7p0m5w640.jpg,"U.S. President Donald Trump said on Monday that trade negotiations with China were in a much better position than at any time and, asked if he could delay planned tariffs on Chinese goods, replied: ""Anything is possible"".",Positive,Article,Reuters,"Mon, 26 Aug 2019 06:12:34 -0400",
"Trade War Seesaw Continues As National Emergency Worry Emerges",https://www.investopedia.com/u-s-china-trade-war-what-if-trump-declares-a-national-emergency-4768513,https://cdn.snapi.dev/images/v1/1/1/11naem-1.jpg,"Trump threatened to declare a national emergency that would allow him to impose sweeping trade sanctions before saying the two countries will be restarting talks.",Negative,Article,Investopedia,"Mon, 26 Aug 2019 06:10:19 -0400",
"US-China trade talks won't break down despite latest escalation, expert says",https://www.cnbc.com/2019/08/26/us-china-trade-talks-wont-break-down-despite-latest-escalation-csis.html,https://cdn.snapi.dev/images/v1/l/5/105995199-1561815754057rts2k40l.jpg,"Neither the U.S. nor China wants to be seen as the party that derailed trade talks, says William Reinsch of Center for Strategic and International Studies.",Positive,Article,CNBC,"Mon, 26 Aug 2019 00:55:00 -0400",
"Oil rises as U.S.-China trade comments calm markets",https://www.reuters.com/article/us-global-oil/oil-rises-as-u-s-china-trade-comments-calm-markets-idUSKCN1VH02O,https://cdn.snapi.dev/images/v1/c/9/m02d20190827t2i1423125454rlynxnpef7q01cw640.jpg,"Oil prices rose on Tuesday after U.S. President Donald Trump predicted a trade deal with China after positive comments by Beijing, calming nerves after a round of tit-for-tat tariff hikes had sent markets reeling.",Positive,Article,Reuters,"Mon, 26 Aug 2019 22:42:15 -0400",oil
"Asia stocks, bond yields climb as trade war fears ebb",https://www.reuters.com/article/us-global-markets/asia-stocks-bond-yields-climb-as-trade-war-fears-ebb-idUSKCN1VH03A,https://cdn.snapi.dev/images/v1/q/f/m02d20190827t2i1423127416rlynxnpef7q01sw640.jpg,"Asian stocks rose in step with their global peers while safe-haven bonds retreated on Tuesday, as signs Sino-U.S. trade hostilities might be easing for now helped restore investor confidence after the previous session's rout.",Positive,Article,Reuters,"Mon, 26 Aug 2019 22:41:27 -0400",
"Japan automakers need not worry about U.S. trade talks outcome: Motegi",https://www.reuters.com/article/us-usa-trade-japan/japan-automakers-need-not-worry-about-u-s-trade-talks-outcome-motegi-idUSKCN1VH06K,https://cdn.snapi.dev/images/v1/m/0/m02d20190827t2i1423146737rlynxnpef7q05mw640.jpg,"Japanese Economy Minister Toshimitsu Motegi said on Tuesday he did not think U.S.-Japan trade talks would result in an outcome that would cause concern for Japanese automakers.",Positive,Article,Reuters,"Mon, 26 Aug 2019 22:27:00 -0400",
"Stocks jump after Trump says he wants trade deal with China",https://nypost.com/2019/08/26/stocks-jump-after-trump-says-he-wants-trade-deal-with-china/,https://cdn.snapi.dev/images/v1/a/o/donald-trump-14jpgquality90stripall.jpg,"Wall Street stepped back into stocks Monday after President Trump signaled — yet again — that he wants to work out a trade deal with China. Early Monday, President Trump told reporters that the two countries would be “getting back to the table” to try to hammer out a trade deal.",Positive,Article,"New York Post","Mon, 26 Aug 2019 22:20:09 -0400",
"Oil rises after Trump says China trade deal likely",https://www.reuters.com/article/us-global-oil/oil-rises-after-trump-says-china-trade-deal-likely-idUSKCN1VH02O,https://cdn.snapi.dev/images/v1/p/e/m02d20190827t2i1423125454rlynxnpef7q01cw640.jpg,"Oil prices rose on Tuesday after U.S. President Donald Trump said he expected to sign a trade deal with China, calming nerves after a round of tit-for-tat tariff hikes had sent markets reeling.",Positive,Article,Reuters,"Mon, 26 Aug 2019 20:46:57 -0400",oil
"I think Trump has learned his lesson after market volatility, says Art Cashin",https://www.cnbc.com/2019/08/26/i-think-trump-has-learned-his-lesson-after-market-volatility-says-art-cashin.html,https://cdn.snapi.dev/images/v1/v/u/103646844-20160513-nyse-promos-sots-sa-0069-2.jpg,"Art Cashin told CNBC on Monday that President Donald Trump may have learned his lesson in response to market volatility amid the trade tensions.",Neutral,Article,CNBC,"Mon, 26 Aug 2019 17:54:00 -0400",
"Flattening Yield Curves Speak For High Yield Paper",https://www.forbes.com/sites/martinsosnoff/2019/08/26/flattening-yield-curves-speak-for-high-yield-paper/,https://cdn.snapi.dev/images/v1/a/l/nyse42d-1.jpg,"The search for risk-free positive yields, worldwide, drives down our interest rates on Treasuries, just 2% on 30-year paper and wavering. Meanwhile, the fear of recession spreads, keeping a lid on high-yield paper, BB credits and below.",Neutral,Article,Forbes,"Mon, 26 Aug 2019 17:12:57 -0400",
"Trump's aggressive, mixed signals on China whiplash Wall Street",https://www.reuters.com/article/us-usa-stocks-tariffs/trumps-aggressive-mixed-signals-on-china-whiplash-wall-street-idUSKCN1VG298,https://cdn.snapi.dev/images/v1/q/q/m02d20190826t2i1423077910rlynxnpef7p1i5w640.jpg,"President Donald Trump's aggressive stance and often mixed signals in his trade war with China are taking a toll on the shares of U.S. companies that are most reliant on the world's second largest economy.",Neutral,Article,Reuters,"Mon, 26 Aug 2019 17:04:49 -0400",
"Stock Market Today: Biotech in Focus, Trade Talks Steady Stocks",https://investorplace.com/2019/08/stock-market-today-biotech-in-focus-trade-talks-steady-stocks/,https://cdn.snapi.dev/images/v1/e/t/etf35.jpg,"Trade talks gave a lift to stocks, while Johnson & Johnson will be in focus after the close. Here's what happened in the stock market today.",Neutral,Article,InvestorPlace,"Mon, 26 Aug 2019 16:34:50 -0400",
"Dow Jones Today: The Return of Trade Optimism",https://investorplace.com/2019/08/the-dow-jones-industrial-surged-monday-amid-nice-trade-chatter/,https://cdn.snapi.dev/images/v1/d/o/dowjones1600d-300x169.jpg,"Today, Trump, from the G7 summit in France, said China is anxious to make a deal and while the Chinese are urging dialogue between the two sides, media outlets there implied that policymakers' desire to come together with the U.S. on trade isn't as Trump is leading the world to believe.",Positive,Article,InvestorPlace,"Mon, 26 Aug 2019 16:26:00 -0400",
"Bitcoin Volatility Falls To Lowest In 8 Weeks",https://www.forbes.com/sites/cbovaird/2019/08/26/bitcoin-volatility-falls-to-lowest-in-8-weeks/,https://cdn.snapi.dev/images/v1/g/n/0x600.jpg,"Bitcoin's price volatility recently hit an eight-week low. When will this volatility pick up again?",Negative,Article,Forbes,"Mon, 26 Aug 2019 15:43:00 -0400",crypto
"Oil falls 1% as U.S.-Iran optimism faces U.S.",https://www.reuters.com/article/us-global-oil/oil-falls-1-as-u-s-iran-optimism-faces-u-s-china-trade-deal-hopes-idUSKCN1VG01W,https://cdn.snapi.dev/images/v1/7/j/m02d20190826t2i1422798354rlynxnpef7p015w640.jpg,"Oil prices fell 1% on Monday on the outlook for increased supply of Iranian crude after France's president lifted hopes for a deal between Washington and Tehran, but losses were limited by optimism surrounding a U.S.-China trade deal.",Negative,Article,Reuters,"Mon, 26 Aug 2019 15:12:42 -0400",oil
"Wall Street bounces on softer trade tone",https://www.reuters.com/article/us-usa-stocks/wall-street-bounces-on-softer-trade-tone-idUSKCN1VG18K,https://cdn.snapi.dev/images/v1/h/w/m02d20190826t2i1422982003rlynxnpef7p106w640.jpg,"U.S. stocks rose on Monday, as major indexes bounced following a sharp sell-off in the prior session, as U.S. President Donald Trump forecast a trade deal with China and somewhat cooled investor concerns after a ramp up in combativeness derailed markets last week.",Positive,Article,Reuters,"Mon, 26 Aug 2019 14:43:19 -0400",
"Technical Stars Aligned for Semiconductor Bear Market",https://www.investopedia.com/technical-stars-aligned-for-semiconductor-bear-market-4768528,https://cdn.snapi.dev/images/v1/5/s/5sc.jpg,"The Philadelphia Semiconductor Index has completed a bearish rising wedge pattern at multi-decade resistance, raising odds for a secular decline.",Negative,Article,Investopedia,"Mon, 26 Aug 2019 14:19:23 -0400",tanalysis
"Wall Street rises after Trump's softer stance on trade",https://www.reuters.com/article/us-usa-stocks/wall-street-rises-after-trumps-softer-stance-on-trade-idUSKCN1VG18K,https://cdn.snapi.dev/images/v1/a/e/m02d20190826t2i1422982003rlynxnpef7p106w640.jpg,"Wall Street's main indexes rose 1% on Monday as U.S. President Donald Trump eased his stance on trade with China, calming investor nerves after an intense feud between the world's top two economies last week sent stocks tumbling.",Positive,Article,Reuters,"Mon, 26 Aug 2019 13:25:54 -0400",
"Oil falls as U.S.-Iran optimism faces U.S.",https://www.reuters.com/article/us-global-oil/oil-falls-as-u-s-iran-optimism-faces-u-s-china-trade-deal-hopes-idUSKCN1VG01W,https://cdn.snapi.dev/images/v1/2/i/m02d20190826t2i1422798354rlynxnpef7p015w640.jpg,"Oil prices edged lower on Monday on the outlook for increased supply of Iranian crude after France's president lifted hopes for a deal between Washington and Tehran, but losses were limited by growing hopes that the United States and China could make a deal to end their trade war.",Negative,Article,Reuters,"Mon, 26 Aug 2019 13:24:41 -0400",oil
"Stocks hitting new lows more than double new highs despite broad market rally",https://www.marketwatch.com/story/stocks-hitting-new-lows-more-than-double-new-highs-despite-broad-market-rally-2019-08-26,https://cdn.snapi.dev/images/v1/e/t/etf40.jpg,"Despite the broad stock market rally, the number of stocks hitting new 52-week lows was double the number hitting new highs on the NYSE, and more than triple on the Nasdaq.",Negative,Article,"Market Watch","Mon, 26 Aug 2019 13:21:34 -0400",
"China's New Investment Thesis: 'Wax On, Wax Off'",https://www.forbes.com/sites/kenrapoza/2019/08/26/chinas-new-investment-thesis-wax-on-wax-off/,https://cdn.snapi.dev/images/v1/q/r/0x600.jpg,"“Here are the Two Rules of Miyagi-Ryu Karate. Rule Number 1: ‘Karate for defense only.",Neutral,Article,Forbes,"Mon, 26 Aug 2019 13:04:14 -0400",
"Are All Your Ducks in a Row? Positioning Your Portfolio for the Market's Next Move",https://www.forbes.com/sites/greatspeculations/2019/08/26/are-all-your-ducks-in-a-row-positioning-your-portfolio-for-the-markets-next-move/,https://cdn.snapi.dev/images/v1/d/u/duck292-1.jpg,"As the topic of recession remains top of mind for many investors, now is the opportune time to consider preparing your portfolio in the event of a pullback.",Neutral,Article,Forbes,"Mon, 26 Aug 2019 13:03:00 -0400",
"Wall Street sees elevated recession risk, market woes after US and China stoke trade fears",https://www.cnbc.com/2019/08/26/wall-street-sees-elevated-recession-risk-amid-us-china-trade-fight.html,https://cdn.snapi.dev/images/v1/e/x/104828604-gettyimages-810759126.jpg,"Some of Wall Street's top economists and strategists see last week's trade war escalation as an ominous sign for the economy and markets.",Negative,Article,CNBC,"Mon, 26 Aug 2019 12:57:00 -0400",
"Deep Dive: This dividend-stock strategy is for investors who want an attractive monthly income stream",https://www.marketwatch.com/story/this-dividend-stock-strategy-is-for-investors-who-want-an-attractive-monthly-income-stream-2019-08-26,https://cdn.snapi.dev/images/v1/s/t/stock92s-1.jpg,"(This is the second in a series about dividend stocks in today’s low interest-rate environment based on interviews with professional investors.",Positive,Article,"Market Watch","Mon, 26 Aug 2019 12:51:01 -0400",dividend
"Digital Currency Execs: Bakkt's Imminent Launch Signals Institutional Participation In Crypto",https://www.benzinga.com/markets/cryptocurrency/19/08/14320985/digital-currency-execs-bakkts-imminent-launch-signals-institutional-participation-in-crypt,https://cdn.snapi.dev/images/v1/q/t/blockchain-3448529-1920-1.jpg,"Bakkt, a subsidiary of New York Stock Exchange owner Intercontinental Exchange, has finally announced a launch date for its physically delivered Bitcoin Futures: Sept.",Neutral,Article,Benzinga,"Mon, 26 Aug 2019 12:35:24 -0400",crypto
"Global stocks, dollar rise as Trump remarks ease China trade tensions",https://www.reuters.com/article/us-global-markets/global-stocks-dollar-rise-as-trump-remarks-ease-china-trade-tensions-idUSKCN1VF105,https://cdn.snapi.dev/images/v1/w/2/m02d20190826t2i1423008070rlynxnpef7p14tw640.jpg,"A  global gauge of equities rose on Monday and the dollar recovered from earlier losses as U.S. President Donald Trump said Chinese officials had contacted Washington about resuming trade negotiations, after signs of escalation in the U.S.",Positive,Article,Reuters,"Mon, 26 Aug 2019 12:16:35 -0400",
"U.S. business investment appears to struggle in third quarter",https://www.reuters.com/article/us-usa-economy/u-s-business-investment-appears-to-struggle-in-third-quarter-idUSKCN1VG1DV,https://cdn.snapi.dev/images/v1/g/2/m02d20190826t2i1423005563rlynxnpef7p0w6w640.jpg,"New orders for key U.S.-made capital goods rose modestly in July while shipments fell by the most in nearly three years, pointing to continued weakness in business investment and a slowdown in economic growth early in the third quarter.",Negative,Article,Reuters,"Mon, 26 Aug 2019 12:06:13 -0400",
"Trump's softer stance on trade pushes Wall Street higher",https://www.reuters.com/article/us-usa-stocks/trumps-softer-stance-on-trade-pushes-wall-street-higher-idUSKCN1VG18K,https://cdn.snapi.dev/images/v1/z/u/m02d20190826t2i1422982003rlynxnpef7p106w640.jpg,"Wall Street's main indexes rose on Monday as U.S. President Donald Trump eased his stance on trade with China, calming investor nerves after an intense feud between the world's top two economies last week sent stocks tumbling.",Neutral,Article,Reuters,"Mon, 26 Aug 2019 12:03:47 -0400",
"Oil steadies as U.S.-Iran optimism faces U.S.",https://www.reuters.com/article/us-global-oil/oil-steadies-as-u-s-iran-optimism-faces-u-s-china-trade-deal-hopes-idUSKCN1VG01W,https://cdn.snapi.dev/images/v1/l/x/m02d20190826t2i1422798354rlynxnpef7p015w640.jpg,"Oil prices steadied on Monday after France's president lifted hopes for a deal between the United States and Iran, while optimism for easing U.S.-China trade tensions supported prices.",Positive,Article,Reuters,"Mon, 26 Aug 2019 12:03:07 -0400",oil
"Japan PM Abe: Stable U.S.-China relations crucial for global economy",https://www.reuters.com/article/us-g7-summit-japan/japan-pm-abe-stable-u-s-china-relations-crucial-for-global-economy-idUSKCN1VG1PT,https://cdn.snapi.dev/images/v1/6/s/m02d20190826t2i1423001963rlynxnpef7p13hw640.jpg,"Japanese Prime Minister Shinzo Abe said on Monday stable relations between the United States and China are ""very important"" not just for these economies, but for the sake of the global economy.",Neutral,Article,Reuters,"Mon, 26 Aug 2019 11:47:15 -0400",
"CNBC Takes Closer Look At Auto Stocks Amid Trade War Concerns",https://www.benzinga.com/media/19/08/14326542/cnbc-takes-closer-look-at-auto-stocks-amid-trade-war-concerns,https://cdn.snapi.dev/images/v1/z/7/car-933269-1920.jpg,"China is the world's largest market for cars, and a slowdown in its domestic economy presents a potential challenge for U.S.",Neutral,Article,Benzinga,"Mon, 26 Aug 2019 11:24:41 -0400",
"The Most Actively Traded Stocks On OTC Markets In July",https://www.benzinga.com/markets/cannabis/19/08/14309841/the-most-actively-traded-stocks-on-otc-markets-in-july,https://cdn.snapi.dev/images/v1/s/r/jose-martin-ramirez-c-45sjajsjarq-unsplash.jpg,"This post is from Benzinga's Partner Content team, and not its Newsdesk More than 4 billion shares—or $7.7 billion—exchanged hands on the OTCQX Best Market and OTCQB Venture Market in July.",Neutral,Article,Benzinga,"Mon, 26 Aug 2019 11:02:04 -0400",
"Top options trader says now is the perfect time to buy the market dip",https://www.cnbc.com/2019/08/26/top-options-trader-says-now-is-the-perfect-time-to-buy-the-market-dip.html,https://cdn.snapi.dev/images/v1/1/0/105898201-1557258595130gettyimages-1141632118.jpeg,"Optimize Advisors' Michael Khouw outlines a strategy to get in on a short-term bounce on the cheap.",Positive,Article,CNBC,"Mon, 26 Aug 2019 10:26:00 -0400",
"Wall Street bounces as Trump softens stance on trade war",https://www.reuters.com/article/us-usa-stocks/wall-street-bounces-as-trump-softens-stance-on-trade-war-idUSKCN1VG18K,https://cdn.snapi.dev/images/v1/n/w/m02d20190826t2i1422969001rlynxnpef7p0s5w640.jpg,"Wall Street rebounded on Monday after U.S. President Donald Trump sought to ease trade tensions with China, soothing investor nerves after an intense feud between the world's top two economies last week sent stocks into a tailspin.",Positive,Article,Reuters,"Mon, 26 Aug 2019 10:02:09 -0400",
"Markets Hopeful on China Deal, Durable Goods Mixed",http://www.zacks.com/stock/news/489357/markets-hopeful-on-china-deal-durable-goods-mixed,https://cdn.snapi.dev/images/v1/5/0/etf39.jpg,"President Trump has announced that China wants to make a trade deal, and that it is ""possible"" for the president to delay new tariffs.",Positive,Article,"Zacks Investment Research","Mon, 26 Aug 2019 09:58:00 -0400",
"As Trade Rattles Market, Semiconductor And Transportation Stocks Top Of Mind",https://www.forbes.com/sites/jjkinahan/2019/08/26/as-trade-rattles-market-semiconductor-and-transportation-stocks-top-of-mind/,https://cdn.snapi.dev/images/v1/e/i/getty-images-2.jpg,"Volatility is still elevated to start the week, despite some positive trade comments that came out this morning. Also, Treasury yields aren’t far above recent lows.",Neutral,Article,Forbes,"Mon, 26 Aug 2019 09:44:00 -0400",
"Dow opens with 200 point gain after Trump says China interested in trade talks",https://www.marketwatch.com/story/dow-opens-with-200-point-gain-after-trump-says-china-interested-in-trade-talks-2019-08-26,https://cdn.snapi.dev/images/v1/i/s/istock-3.jpg,"U.S. stocks opened higher on Monday after President Donald Trump said Beijing was interested in going back to the negotiating table, bolstering hopes for an easing of trade tensions. The S&P 500  rose 0.8% to 2,870.",Positive,Article,"Market Watch","Mon, 26 Aug 2019 09:38:34 -0400",
"Trump's China Trade Deal Ray Of Hope Expires Sept. 1; Dow Jones Jumps",https://www.investors.com/news/economy/trump-china-trade-deal-hope-expires-sept-1-dow-jones/,https://cdn.snapi.dev/images/v1/d/o/dowjones1600b-300x169.jpg,"President Trump touted new China talks, sparking a Dow Jones rally on Monday. Yet new tariffs, if they take effect Sept.",Positive,Article,"Investors Business Daily","Mon, 26 Aug 2019 09:31:42 -0400",
"Shoe retailer Cole Haan prepares for IPO",https://www.cnbc.com/2019/08/26/shoe-retailer-cole-haan-prepares-for-ipo.html,https://cdn.snapi.dev/images/v1/1/0/106096800-1566823915407gettyimages-180277790.jpeg,"Shoe retailer Cole Haan is preparing for an initial public offering, a company spokeswoman confirmed to CNBC on Monday morning.",Neutral,Article,CNBC,"Mon, 26 Aug 2019 09:00:00 -0400",
"5 Key Trump Moments From The Weekend’s G7 Summit",https://www.forbes.com/sites/lisettevoytko/2019/08/26/5-key-trump-moments-from-the-weekends-g7-summit/,https://cdn.snapi.dev/images/v1/t/r/trjm24-1.jpg,"After bailing on last year’s summit, Trump is front and center in France.",Neutral,Article,Forbes,"Mon, 26 Aug 2019 08:53:20 -0400",
"Mohamed El-Erian warns that a ceasefire is the 'best we could hope' in the US-China trade war",https://www.cnbc.com/2019/08/26/mohamed-el-erian-ceasefire-best-we-could-hope-in-us-china-trade-war.html,https://cdn.snapi.dev/images/v1/g/6/105237307-img-8496.jpg,"Economist Mohamed El-Erian says he's becoming more and more pessimistic that the U.S. and China can reach a deal to end their trade war.",Neutral,Article,CNBC,"Mon, 26 Aug 2019 08:41:00 -0400",
"AI Engine Says S&P 500 Is 2X More Likely To Drop Today Than A Normal Day",https://www.forbes.com/sites/greatspeculations/2019/08/26/ai-engine-says-sp-500-is-2x-more-likely-to-drop-today-than-a-normal-day/,https://cdn.snapi.dev/images/v1/m/0/m02d20190826t2i1422944926rlynxnpef7p0s5w640.jpg,"The S&P500 dropped 2.5% over trading last Friday. According to the Trefis AI engine, there is a 26% chance the index will drop by 1% or more the day after a 2.5% drop as opposed to 13% chance after a normal day.",Negative,Article,Forbes,"Mon, 26 Aug 2019 08:30:00 -0400",
"Cannabis stock Canopy rises after analyst says company will get boost from Canada's '2.0 market'",https://www.cnbc.com/2019/08/26/canopy-rises-after-analyst-says-is-will-get-boost-from-canadas-2point0-market.html,https://cdn.snapi.dev/images/v1/k/f/106079689-1565818438229gettyimages-899559492.jpeg,"""The Canadian space is about to gain a fair amount of pricing power, in our view, as the 2.0 market opens up late this year,"" the analyst says.",Positive,Article,CNBC,"Mon, 26 Aug 2019 08:17:00 -0400",cannabis
